Work Date,Task Name,Number of Hours,Approved Hours
2025-09-07,Initial project setup and requirements analysis,4,
2025-09-14,Resume parser core development - PDF/DOCX extraction,5,
2025-09-21,Contact information extraction (name, email, phone),4,
2025-09-28,Experience and education parsing implementation,5,
2025-10-05,Skills extraction and NLP integration,4,
2025-10-12,FastAPI application setup and endpoint development,5,
2025-10-19,File upload and base64 parsing endpoints,4,
2025-10-26,S3 and URL parsing endpoints implementation,5,
2025-11-02,API authentication and token management system,4,
2025-11-09,Batch processing endpoint development,4,
2025-11-16,Error handling and response formatting,3,
2025-11-23,Docker containerization and Dockerfile creation,5,
2025-11-30,AWS Lambda handler development and configuration,4,
2025-12-07,Lambda deployment scripts and documentation,4,
2025-12-14,API documentation and deployment guides creation,4,
2025-12-21,Postman collection setup and final testing,4,
